{
  "artifact_id": "PLAN-ARTIFACTS-001",
  "execution": {
    "prerequisites": {
      "GATE-01": "not_satisfied",
      "GATE-02": "not_satisfied"
    },
    "tasks": {
      "T-001": {
        "evidence_refs": [],
        "reason": null,
        "state": "PENDING"
      },
      "T-002": {
        "evidence_refs": [],
        "reason": null,
        "state": "PENDING"
      },
      "T-003": {
        "evidence_refs": [],
        "reason": null,
        "state": "PENDING"
      },
      "T-004": {
        "evidence_refs": [],
        "reason": null,
        "state": "PENDING"
      },
      "T-005": {
        "evidence_refs": [],
        "reason": null,
        "state": "PENDING"
      },
      "T-006": {
        "evidence_refs": [],
        "reason": null,
        "state": "PENDING"
      },
      "T-007": {
        "evidence_refs": [],
        "reason": null,
        "state": "PENDING"
      },
      "T-008": {
        "evidence_refs": [],
        "reason": null,
        "state": "PENDING"
      },
      "T-009": {
        "evidence_refs": [],
        "reason": null,
        "state": "PENDING"
      },
      "T-010": {
        "evidence_refs": [],
        "reason": null,
        "state": "PENDING"
      },
      "T-011": {
        "evidence_refs": [],
        "reason": null,
        "state": "PENDING"
      },
      "T-012": {
        "evidence_refs": [],
        "reason": null,
        "state": "PENDING"
      },
      "T-013": {
        "evidence_refs": [],
        "reason": null,
        "state": "PENDING"
      },
      "T-014": {
        "evidence_refs": [],
        "reason": null,
        "state": "PENDING"
      },
      "T-015": {
        "evidence_refs": [],
        "reason": null,
        "state": "PENDING"
      },
      "T-016": {
        "evidence_refs": [],
        "reason": null,
        "state": "PENDING"
      },
      "T-017": {
        "evidence_refs": [],
        "reason": null,
        "state": "PENDING"
      },
      "T-018": {
        "evidence_refs": [],
        "reason": null,
        "state": "PENDING"
      },
      "T-019": {
        "evidence_refs": [],
        "reason": null,
        "state": "PENDING"
      },
      "T-020": {
        "evidence_refs": [],
        "reason": null,
        "state": "PENDING"
      },
      "T-021": {
        "evidence_refs": [],
        "reason": null,
        "state": "PENDING"
      },
      "T-022": {
        "evidence_refs": [],
        "reason": null,
        "state": "PENDING"
      },
      "T-023": {
        "evidence_refs": [],
        "reason": null,
        "state": "PENDING"
      },
      "T-024": {
        "evidence_refs": [],
        "reason": null,
        "state": "PENDING"
      }
    }
  },
  "format": "codearbiter.artifact",
  "format_version": "0.1.0",
  "governance": {
    "approvals": [],
    "review_notes": [
      "Second-pass author review corrected schema, execution-scope, evidence-fingerprint, read-validation and farm-binding defects. No user approval, independent implementation review, or runtime acceptance is recorded."
    ],
    "state": "draft"
  },
  "integrity": {
    "model_sha256": "2972ffb4e859d9cc631945c164a71f5ba73e0a7f893483a2429b66cd888c4655",
    "normative_sha256": "70555c2020a55d9ca3c374b6406d5cc2b926a70bf0989cbb0d1e9e55344ca8e2",
    "symbol_count": 59
  },
  "kind": "plan",
  "normative": {
    "baseline": {
      "commit": "45a17319f9ffda327cbdf3f3d40849bae8e920c0",
      "observed_date": "2026-09-14",
      "repository": "https://github.com/arbiterForge/codeArbiter"
    },
    "checkpoints": [
      {
        "depends_on": [],
        "exit": "Consumer inventory, no-growth baseline, strict hash domains and spec semantics reviewed; both kinds modeled.",
        "id": "CP-01",
        "tasks": [
          "T-001",
          "T-002",
          "T-003",
          "T-004"
        ],
        "title": "Schemas and source-of-truth boundaries"
      },
      {
        "depends_on": [
          "CP-01"
        ],
        "exit": "Plan references/DAG, durable symbols and offline safe rendering demonstrated for both kinds.",
        "id": "CP-02",
        "tasks": [
          "T-005",
          "T-006",
          "T-007",
          "T-008"
        ],
        "title": "Plan semantics and readable artifacts"
      },
      {
        "depends_on": [
          "CP-02"
        ],
        "exit": "Bounded reads, locked hash-CAS, native recovery primitives and typed CLI work together.",
        "id": "CP-03",
        "tasks": [
          "T-009",
          "T-010",
          "T-011",
          "T-012"
        ],
        "title": "Safe read and mutation engine"
      },
      {
        "depends_on": [
          "CP-03"
        ],
        "exit": "Existing authority, evidence-bound task state, authoring and resume integration work without new surface.",
        "id": "CP-04",
        "tasks": [
          "T-013",
          "T-014",
          "T-015",
          "T-016"
        ],
        "title": "Complete existing workflow path"
      },
      {
        "depends_on": [
          "CP-04"
        ],
        "exit": "Discovery, farm projection, loss-aware import and interruption-safe pair cutover are verified.",
        "id": "CP-05",
        "tasks": [
          "T-017",
          "T-018",
          "T-019",
          "T-020"
        ],
        "title": "Compatibility and selected conversion"
      },
      {
        "depends_on": [
          "CP-05"
        ],
        "exit": "Native and generated-host gates, cross-kind conformance and pilot/runbook acceptance complete.",
        "id": "CP-06",
        "tasks": [
          "T-021",
          "T-022",
          "T-023",
          "T-024"
        ],
        "title": "Package, prove and roll out"
      }
    ],
    "criterion_dispositions": [],
    "prerequisites": [
      {
        "id": "GATE-01",
        "requirement": "Use the existing feature approval policy for the exact normative identities. This requested draft preview does not authorize implementation.",
        "source_refs": [
          "SRC-01",
          "SRC-04"
        ],
        "title": "Approve this specification and plan"
      },
      {
        "id": "GATE-02",
        "requirement": "Use the existing ADR workflow to record the Go helper and typed file-schema decision, explicitly clarifying ADR-0004 while retaining file-based state and stdlib-only Python hooks. The existing ADR allocator owns the final filename. Do not edit a protected accepted ADR in place.",
        "source_refs": [
          "SRC-11",
          "SRC-12"
        ],
        "title": "Ratify the narrow architecture addition"
      }
    ],
    "retired_symbols": [],
    "sections": [
      {
        "blocks": [
          {
            "refs": [],
            "text": "Implement the companion specification as one release that converts both feature specifications and implementation plans to typed, canonical, human-readable HTML. The binary is the shared mechanism; existing codeArbiter workflows remain the user-facing interface.",
            "type": "paragraph"
          },
          {
            "refs": [],
            "text": "This is an explicitly requested DRAFT planning preview. It is bound to the companion draft’s normative hash for review and traceability, but is not eligible for execution. No code has been implemented and no task has been accepted. Approving the documents is not implied by requesting them.",
            "type": "paragraph"
          },
          {
            "columns": [
              "Preserved",
              "Changed"
            ],
            "refs": [],
            "rows": [
              [
                "Existing /feature, /sprint and governed execution tools.",
                "Their active routines use an on-demand internal binary protocol."
              ],
              [
                "Existing author agents and review/approval policies.",
                "Specs allocate stable contract identities; plans reference them."
              ],
              [
                "Existing TDD and human checkpoint gates.",
                "Task progress becomes typed state, with current-contract evidence."
              ],
              [
                "Farm’s current closed runtime schema.",
                "Its JSON becomes a digest-bound current-slice projection of HTML."
              ],
              [
                "Legacy project context, taskboards, tickets and ADR artifacts.",
                "Only feature specs and implementation plans move in this release."
              ]
            ],
            "type": "table"
          },
          {
            "refs": [],
            "text": "Review revision 2 uses reference schema 0.2.0 and renderer 0.2.0 because the unpublished reference schema changed incompatibly. The proposed first codeArbiter product release is still v0.1.0. Document revision, schema version and product release are independent. This is not a released format upgrade or an approved implementation.",
            "type": "paragraph"
          }
        ],
        "id": "SEC-PLAN-INTENT",
        "title": "Implementation objective and execution boundary"
      },
      {
        "blocks": [
          {
            "refs": [
              "SRC-01",
              "SRC-02",
              "SRC-03",
              "SRC-04",
              "SRC-05",
              "SRC-06",
              "SRC-09"
            ],
            "text": "Based on main at 45a17319f9ffda327cbdf3f3d40849bae8e920c0. Relevant producer/consumer source was inspected, including brainstorming, planning, TDD, feature resume, execution and the farm projection leaf. Full consumer closure is planned work, not an asserted completed audit.",
            "type": "paragraph"
          },
          {
            "refs": [],